{
  "name": "Stock Market Research Agent",
  "description": "A comprehensive stock market research agent that analyzes stocks, fetches news, identifies trends, and provides specific recommendations and predictions.",
  "version": "1.0.0",
  "author": "AgentHub",
  "entry_point": "stock_market_agent.py:main",
  "agent_type": "function",
  "email": "team@agenthub.com",
  "config_schema": {
    "stock_symbols": {
      "type": "string",
      "description": "Comma-separated list of stock symbols to analyze (e.g., AAPL,MSFT,GOOGL)",
      "required": true,
      "placeholder": "AAPL,MSFT,GOOGL"
    },
    "analysis_depth": {
      "type": "choice",
      "description": "Depth of analysis to perform",
      "required": true,
      "default": "comprehensive",
      "choices": ["basic", "standard", "comprehensive", "expert"]
    },
    "prediction_timeframe": {
      "type": "choice",
      "description": "Timeframe for predictions",
      "required": true,
      "default": "3months",
      "choices": ["1week", "1month", "3months", "6months", "1year"]
    },
    "risk_tolerance": {
      "type": "choice",
      "description": "Risk tolerance level for recommendations",
      "required": true,
      "default": "moderate",
      "choices": ["conservative", "moderate", "aggressive"]
    },
    "investment_amount": {
      "type": "float",
      "description": "Investment amount to consider for recommendations (in USD)",
      "default": 10000
    },
    "api_key_alpha_vantage": {
      "type": "string",
      "description": "Alpha Vantage API key for stock data (optional)",
      "required": false,
      "placeholder": "Your Alpha Vantage API key"
    },
    "api_key_news": {
      "type": "string",
      "description": "News API key for financial news (optional)",
      "required": false,
      "placeholder": "Your News API key"
    }
  },
  "requirements": [
    "yfinance",
    "pandas",
    "numpy",
    "requests",
    "beautifulsoup4",
    "textblob",
    "plotly",
    "ta",
    "openai",
    "python-dotenv",
    "schedule",
    "lxml",
    "feedparser"
  ],
  "tags": ["finance", "stock-market", "research", "analysis", "predictions", "trading"],
  "category": "Financial Analysis"
} 